system_version,sheet_name,round,question,answer,context,meta_json
local_rag,local_rag,R1,What is the specific scale factor (arcseconds per step) used by the teloffset program to calculate guideprobe movement?,The specific scale factor used by the teloffset program to calculate guideprobe movement is 0.007153 arcseconds per step. This value is defined in the context as `scalefactor = 0.007153;`.,"[alfosc_slit_off_ocr.pdf | chunk 9] way to report it back to the caller is by using the exit status. The following values will (can) be returned e 0) Normal termination (all ok). e -l Unable to establish RPC connection to TCS. e -? Telescope is not being autoguided. e -3 Guideprobe movement will result in X and Y value out of range. e -4 Guideprobe movement will result in X value out of range. e -5 Guideprobe movement will result in Y value out of range. Chapter 6 Bugs The actual (measured TGT X,Y) differs from the desired by between 0 and 10 pixels. Possibly the various scales used have not been determined well enough. Chapter 7 Program listing. 7.1 Main program. #include <stdio.h> #include <math.h> #include <time.h> #include ""../hostintf5/gettcs5.h"" /* Functions used: FieldRotationDelta MoveRADelta MoveDECDelta AutoGuideDff AutoGuideOn MoveGuideprobeDeltaxX MoveGuideprobeDeltaY MoveGuideprobeX; MoveGuideprobeY; Usage: of

[output_ocr.pdf | chunk 9] in X value out of range. 5: Guideprobe movement will result in Y value out of range. +/ #define DEBUG TRUE Je gad gd agg gd agg agg dg Rag agg kk cc / main(arge, argv) int argc; char **argv; double Xmovement, Ymovement; /* The amount to offset */ int OldGuideprobeX, OldGuideprobeY; int NewGuideprobeX, NewGuideprobeY; int AutoGuiding; /* 1: autoguiding 0: not autoguiding */ int AutoguidingWasOn = 0; /* 1: Yes it was 0: No it wasn’t */ double field; /* Field rotation */ double field_off = 90.0; /* Field zeropoint offset (field -90 is zero)*/ double scalefactor = 0.007153; /* asec pr. ag step */ CHAPTER 6. PROGRAM LISTING. 10 int TCS_accesscode; int *FieldRotDeltaRes, RADeltaRes, DECDeltaRes, AutoGuide0ffRes, AutoGuideOnRes, GuideprobeDeltaxkRes, GuideprobeDeltaYRes, GuideprobeXRes, GuideprobeYRes; char *getserver; fieldrotdeltatype a, *fieldrotdelta_info = ka; radeltatype b, *radelta_info

[output_ocr.pdf | chunk 12] move the guideprobe opposite the tel. */ /* This is only true if the angle between x,y and alpha,delta is 0 /* /* In any other case, calculate what the angle does */ /* SIGH! */ /* Sign is correct */ NewGuideprobeX = OldGuideprobeX - (int) (¥movement / scalefactor); NewGuideprobeY = OldGuideprobeY - (int) (Xmovement / scalefactor); /* Check if within limits, but only if we where guiding. */ if ( ((NewGuideprobeX <= 1100.0) || (NewGuideprobeX >= 225000.0)) && ((NewGuideprobeY <= 1100.0) || (MNewGuideprobeY >= 165000.0)) ) { fprintf(stdout ,""Error: Guideprobe X and Y outside limits.\n""); exit(-3); CHAPTER 6. PROGRAM LISTING. ll } if ( (NewGuideprobeX <= 1100.0) || (NewGuideprobeX >= 225000.0) ) { fprintf(stderr,""Error: Guideprobe X outside lLimits.\n""); exit(-4); } if ( (NewGuideprobeY <= 1100.0) || (NewGuideprobeY >= 165000.0) ) { fprintf(stderr,""Error: Guideprobe Y outside limits.\n'"");

[alfosc_slit_off_ocr.pdf | chunk 3] he coordinate system ro- tated ”field” degrees: A, = A, cos( field + zeropoint sieia) — A, sin( field + zeropoint sieia) As = A,- sin( field + zeropoint ficia) + A, - cos( field + zeropoint sie) The value of the 6 movement is negated because increasing values of CCD Y corresponds to descreasing declination. The telescope is moved. The amount to move the guideprobe is determined as As Xnew = Xo aan “0.00732 A. Ynew = Youd ne See 0.007342 The new guideprobe position is checked to be within limits. The guideprobe is moved. Waits until the guideprobe has reached its new position. Waits until the telescope is tracking. Switches autoguiding on. Returns to caller with exit status 0 (zero). Chapter 2 Changes since last version From version 0.1 the following things have been changed e The check of the guideprobe limits have been moved so that the check is being performed before any telescope or g

[output_ocr.pdf | chunk 3] As = A,- sin( field + zeropoint ficia) + A, - cos( field + zeropoint sie) The value of the 6 movement is negated because increasing values of CCD Y corresponds to descreasing declination. The telescope is moved. The guideprobe is moved. Waits until the guideprobe has reached its new position. Waits until the telescope is tracking. Switches autoguiding on. Returns to caller with exit status 0 (zero). If the offset size is bigger than a certain size, the guideprobe will end outside its limits. It is desirable to be able to make such big offsets, so the program is able to do that. If the telescope is being autoguided before the program is executed, the actions described above will be taken. If, however the telescope is not being autoguided before the offset program is run, the program will do as follows Calculates the amount to move the telescope, given the field rotation. Moved the telesco","{""context_chunk_count"": 5}"
local_rag,local_rag,R1,What is the default focus position (foc-pos) and TV focus (tv-foc) for the ALFOSC instrument?,"The provided context does not contain specific information about the default focus position (foc-pos) or TV focus (tv-foc) for the ALFOSC instrument. The context mainly discusses commands related to focusing and provides examples of how certain focus-related commands are used, but it does not specify default values for these parameters.","[www.not.iac.es/observing/seq/new/seq-command.php?i=30.tmp.html | chunk 2] Quelle: https://www.facebook.com/Nordic.Optical.Telescope/

fosc.expose alfosc.focuspyr-auto alfosc.focus-offset alfosc.snapshot Used In Last Update 0000-00-00 00:00:00 Author PMS Back to top Last modified: November 28 2023

[www.not.iac.es/observing/seq/new/seq-command.php?i=33.tmp.html | chunk None] Quelle: https://www.facebook.com/Nordic.Optical.Telescope/

System alfosc Command focuspyr Arguments Type DATA Short Description Lets the user interactively examine a Focus Pyramid image to determine the focus offset required to bring the telescope in focus. Long Description Interactively examine a focus pyramid image to determine the focus offset required to bring the telescope in focus. The estimated best focus offset determined by the focuspyr-auto script will be presented on screen for comparison. Depends On Used In Last Update 0000-00-00 00:00:00 Author PMS Back to top Last modified: November 28 2023

[www.not.iac.es/observing/seq/new/seq-command.php?i=4.tmp.html | chunk None] Quelle: https://www.facebook.com/Nordic.Optical.Telescope/

System alfosc Command alfoscfocus Arguments [-d] [ready] [step] <n> Type INST Short Description Moves ALFOSC internal focus to step position <n>. [ready] Returns '0' if the element is moving, '1' if it is ready. [step] returns the step position [0-2700] of the ALFOSC internal focus. Long Description Moves ALFOSC internal focus to step position <n>. [ready] returns '0' if the element is moving, '1' if it is ready. [step] returns the step position [0-2700] of the ALFOSC internal focus. Depends On Used In alfosc.acquisition Last Update 0000-00-00 00:00:00 Author JC Back to top Last modified: November 28 2023

[www.not.iac.es/observing/seq/new/docserver.php?i=ALFOSC&t=ANY&u=BASIC&m=SPEC&d=LONG.tmp.html | chunk 9] Quelle: https://www.facebook.com/Nordic.Optical.Telescope/

tected in the image, the focus can be determined in a more interactive mode by using the commands focuspyr-setup, expose, focuspyr, focus-position (see documentation on these commands for further information). Usage example: alfosc.focus -n 4 -t 15 -a nearest Focuses the telescope using the nearest focusfield, doing 4 loops with individual exposures of 15s. TEL alfosc focus-offset [-e] [-d <nn>] Optics in the beam introduces a telescope focus offset (see table ). The 'focus-offset' command checks what is currently in the FASU and ALFOSC filter wheels and applies the corresponding focus offset (using foc-del) when possible. The focus offset introduced by a retarder plate in polarimetry mode is also accounted for. Be very careful when using this command. Focus offset for many optical elements are not known and as a consequence the telescope may in fact not be in focus even after using this

[www.not.iac.es/observing/seq/new/docserver.php?i=ALFOSC&t=ANY&u=GENERAL&m=ANY&d=LONG.tmp.html | chunk 20] Quelle: https://www.facebook.com/Nordic.Optical.Telescope/

be determined in a more interactive mode by using the commands focuspyr-setup, expose, focuspyr, focus-position (see documentation on these commands for further information). Usage example: alfosc.focus -n 4 -t 15 -a nearest Focuses the telescope using the nearest focusfield, doing 4 loops with individual exposures of 15s. TEL alfosc focus-offset [-e] [-d <nn>] Optics in the beam introduces a telescope focus offset (see table ). The 'focus-offset' command checks what is currently in the FASU and ALFOSC filter wheels and applies the corresponding focus offset (using foc-del) when possible. The focus offset introduced by a retarder plate in polarimetry mode is also accounted for. Be very careful when using this command. Focus offset for many optical elements are not known and as a consequence the telescope may in fact not be in focus even after using this command . If the focus offset is","{""context_chunk_count"": 5}"
